{
  "$schema": "../../../info.schema.json",
  "id": "Sol",
  "name": "Sol",
  "translation_key": "map.sol",
  "categories": ["cosmic"],
  "multiplayer_frequency": 20,
  "ffa_frequency": 0,
  "team_frequency": 0,
  "forced_modifiers": ["isWaterNukes:50", "startingGold5M:100"],
  "themes": ["space"],
  "nations": [
    {
      "coordinates": [2419, 1241],
      "name": "Sol",
      "flag": "sol"
    },
    {
      "coordinates": [2340, 853],
      "name": "Terra",
      "flag": "terra"
    },
    {
      "coordinates": [2268, 668],
      "name": "Luna",
      "flag": "luna"
    },
    {
      "coordinates": [2605, 1262],
      "name": "Mercury",
      "flag": "mercury"
    },
    {
      "coordinates": [1806, 1383],
      "name": "Venus",
      "flag": "venus"
    },
    {
      "coordinates": [2196, 1805],
      "name": "Mars",
      "flag": "mars"
    },
    {
      "coordinates": [3341, 1786],
      "name": "Jupiter",
      "flag": "jupiter"
    },
    {
      "coordinates": [955, 651],
      "name": "Saturn",
      "flag": "saturn"
    },
    {
      "coordinates": [3753, 625],
      "name": "Neptune",
      "flag": "neptune"
    },
    {
      "coordinates": [856, 2048],
      "name": "Uranus",
      "flag": "uranus"
    },
    {
      "coordinates": [3596, 342],
      "name": "Triton",
      "flag": "neptune"
    },
    {
      "coordinates": [3445, 1445],
      "name": "Io",
      "flag": "jupiter"
    },
    {
      "coordinates": [3131, 1521],
      "name": "Europa",
      "flag": "jupiter"
    },
    {
      "coordinates": [3187, 2136],
      "name": "Ganymede",
      "flag": "jupiter"
    },
    {
      "coordinates": [2994, 1851],
      "name": "Callisto",
      "flag": "jupiter"
    },
    {
      "coordinates": [414, 197],
      "name": "Sedna",
      "flag": "sedna"
    },
    {
      "coordinates": [208, 803],
      "name": "Salacia",
      "flag": "salacia"
    },
    {
      "coordinates": [272, 1412],
      "name": "Pluto",
      "flag": "pluto"
    },
    {
      "coordinates": [157, 1513],
      "name": "Charon",
      "flag": "pluto"
    },
    {
      "coordinates": [427, 2399],
      "name": "Quaoar",
      "flag": "quaoar"
    },
    {
      "coordinates": [3952, 2386],
      "name": "Haumea",
      "flag": "haumea"
    },
    {
      "coordinates": [4103, 2090],
      "name": "Makemake",
      "flag": "makemake"
    },
    {
      "coordinates": [4292, 1454],
      "name": "Eris",
      "flag": "eris"
    },
    {
      "coordinates": [3927, 120],
      "name": "Orcus",
      "flag": "orcus"
    },
    {
      "coordinates": [2812, 571],
      "name": "Juno",
      "flag": "juno"
    },
    {
      "coordinates": [3082, 1045],
      "name": "Vesta",
      "flag": "vesta"
    },
    {
      "coordinates": [1728, 496],
      "name": "Hygiea",
      "flag": "hygiea"
    },
    {
      "coordinates": [1549, 1088],
      "name": "Eros",
      "flag": "eros"
    },
    {
      "coordinates": [1342, 1639],
      "name": "Ceres",
      "flag": "ceres"
    },
    {
      "coordinates": [2473, 2171],
      "name": "Pallas",
      "flag": "pallas"
    },
    {
      "coordinates": [655, 914],
      "name": "Titan",
      "flag": "saturn"
    },
    {
      "coordinates": [600, 705],
      "name": "Dione",
      "flag": "saturn"
    },
    {
      "coordinates": [1020, 247],
      "name": "Iapetus",
      "flag": "saturn"
    },
    {
      "coordinates": [1242, 323],
      "name": "Mimas",
      "flag": "saturn"
    },
    {
      "coordinates": [1343, 630],
      "name": "Hyperion",
      "flag": "saturn"
    },
    {
      "coordinates": [1326, 802],
      "name": "Tethys",
      "flag": "saturn"
    },
    {
      "coordinates": [1233, 928],
      "name": "Rhea",
      "flag": "saturn"
    },
    {
      "coordinates": [1071, 1021],
      "name": "Enceladus",
      "flag": "saturn"
    },
    {
      "coordinates": [666, 1886],
      "name": "Miranda",
      "flag": "uranus"
    },
    {
      "coordinates": [887, 1786],
      "name": "Ariel",
      "flag": "uranus"
    },
    {
      "coordinates": [818, 2325],
      "name": "Titania",
      "flag": "uranus"
    },
    {
      "coordinates": [1124, 2063],
      "name": "Oberon",
      "flag": "uranus"
    },
    {
      "coordinates": [596, 2134],
      "name": "Umbriel",
      "flag": "uranus"
    },
    {
      "coordinates": [3476, 143],
      "name": "Neptune Trojans",
      "flag": "neptune"
    },
    {
      "coordinates": [809, 1173],
      "name": "Pioneer 10",
      "flag": "us"
    },
    {
      "coordinates": [3474, 1313],
      "name": "Pioneer 11",
      "flag": "us"
    },
    {
      "coordinates": [3871, 1029],
      "name": "Voyager 2",
      "flag": "us"
    },
    {
      "coordinates": [826, 1509],
      "name": "Voyager 1",
      "flag": "us"
    },
    {
      "coordinates": [1961, 1625],
      "name": "Venera 9",
      "flag": "ussr"
    },
    {
      "coordinates": [2467, 1787],
      "name": "Mars Reconnaissance Orbiter",
      "flag": "us"
    },
    {
      "coordinates": [2566, 1111],
      "name": "BepiColombo",
      "flag": "eu"
    },
    {
      "coordinates": [2042, 869],
      "name": "Sputnik 1",
      "flag": "ussr"
    },
    {
      "coordinates": [1277, 2430],
      "name": "Uranus Trojans",
      "flag": "uranus"
    }
  ],
  "custom_tribes": [
    {
      "coordinates": [237, 727],
      "name": "Actaea"
    },
    {
      "coordinates": [352, 1554],
      "name": "Hydra"
    },
    {
      "coordinates": [446, 1408],
      "name": "Kerberos"
    },
    {
      "coordinates": [324, 1284],
      "name": "Nix"
    },
    {
      "coordinates": [186, 1319],
      "name": "Styx"
    },
    {
      "coordinates": [498, 2453],
      "name": "Weywot"
    },
    {
      "coordinates": [1475, 185],
      "name": "153 Hilda"
    },
    {
      "coordinates": [1564, 92],
      "name": "190 Ismene"
    },
    {
      "coordinates": [1647, 165],
      "name": "334 Chicago"
    },
    {
      "coordinates": [1741, 79],
      "name": "361 Bononia"
    },
    {
      "coordinates": [1759, 178],
      "name": "499 Venusia"
    },
    {
      "coordinates": [1868, 57],
      "name": "748 Simeïsa"
    },
    {
      "coordinates": [1959, 78],
      "name": "958 Asplinda"
    },
    {
      "coordinates": [2074, 9],
      "name": "1038 Tuckia"
    },
    {
      "coordinates": [2139, 50],
      "name": "1144 Oda"
    },
    {
      "coordinates": [2146, 158],
      "name": "1162 Larissa"
    },
    {
      "coordinates": [2325, 81],
      "name": "1180 Rita"
    },
    {
      "coordinates": [2437, 23],
      "name": "1202 Marina"
    },
    {
      "coordinates": [2473, 106],
      "name": "1212 Francette"
    },
    {
      "coordinates": [2636, 86],
      "name": "1256 Normannia"
    },
    {
      "coordinates": [2678, 13],
      "name": "1268 Libya"
    },
    {
      "coordinates": [2720, 172],
      "name": "1269 Rollandia"
    },
    {
      "coordinates": [2852, 169],
      "name": "1345 Potomac"
    },
    {
      "coordinates": [2922, 275],
      "name": "1439 Vogtia"
    },
    {
      "coordinates": [1469, 2264],
      "name": "617 Patroclus"
    },
    {
      "coordinates": [1626, 2329],
      "name": "884 Priamus"
    },
    {
      "coordinates": [1569, 2404],
      "name": "1172 Äneas"
    },
    {
      "coordinates": [1743, 2341],
      "name": "1173 Anchises"
    },
    {
      "coordinates": [1786, 2505],
      "name": "1208 Troilus"
    },
    {
      "coordinates": [1829, 2424],
      "name": "1867 Deiphobus"
    },
    {
      "coordinates": [2001, 2459],
      "name": "1870 Glaukos"
    },
    {
      "coordinates": [2042, 2386],
      "name": "1871 Astyanax"
    },
    {
      "coordinates": [2157, 2469],
      "name": "1872 Helenos"
    },
    {
      "coordinates": [2324, 2483],
      "name": "1873 Agenor"
    },
    {
      "coordinates": [2387, 2404],
      "name": "2207 Antenor"
    },
    {
      "coordinates": [2496, 2434],
      "name": "2223 Sarpedon"
    },
    {
      "coordinates": [2683, 2382],
      "name": "2241 Alcathous"
    },
    {
      "coordinates": [2689, 2499],
      "name": "2357 Phereclos"
    },
    {
      "coordinates": [2805, 2444],
      "name": "2363 Cebriones"
    },
    {
      "coordinates": [2938, 2335],
      "name": "2594 Acamas"
    },
    {
      "coordinates": [3038, 2294],
      "name": "2674 Pandarus"
    },
    {
      "coordinates": [3986, 201],
      "name": "Vanth"
    },
    {
      "coordinates": [4207, 1511],
      "name": "Dysnomia"
    },
    {
      "coordinates": [3879, 2327],
      "name": "Namaka"
    },
    {
      "coordinates": [3923, 2498],
      "name": "Hiʻiaka"
    },
    {
      "coordinates": [2077, 1917],
      "name": "Phobos"
    },
    {
      "coordinates": [2296, 1714],
      "name": "Deimos"
    }
  ]
}
