{
  "$schema": "../../../info.schema.json",
  "id": "GatewayToTheAtlantic",
  "name": "Gateway to the Atlantic",
  "translation_key": "map.gatewaytotheatlantic",
  "categories": ["europe"],
  "multiplayer_frequency": 5,
  "nations": [
    {
      "coordinates": [2161, 420],
      "name": "Swiss Confederation",
      "flag": "ch"
    },
    {
      "coordinates": [1938, 263],
      "name": "Duchy of Burgundy",
      "flag": "burgundy"
    },
    {
      "coordinates": [1388, 485],
      "name": "Duchy of Aquitaine",
      "flag": "aquitaine"
    },
    {
      "coordinates": [2137, 636],
      "name": "County of Provence",
      "flag": "provence"
    },
    {
      "coordinates": [1266, 748],
      "name": "Kingdom of Navarre",
      "flag": "navarre"
    },
    {
      "coordinates": [1375, 1190],
      "name": "Kingdom of Valencia",
      "flag": "valencia"
    },
    {
      "coordinates": [1696, 858],
      "name": "Catalonia",
      "flag": "catalonia"
    },
    {
      "coordinates": [543, 807],
      "name": "Kingdom of Galicia",
      "flag": "es-ga"
    },
    {
      "coordinates": [1128, 1388],
      "name": "Emirate of Granada",
      "flag": "granada"
    },
    {
      "coordinates": [523, 1156],
      "name": "Kingdom of Portugal",
      "flag": "kingdom_of_portugal"
    },
    {
      "coordinates": [851, 1805],
      "name": "Marinid Sultanate",
      "flag": "marinid"
    },
    {
      "coordinates": [1424, 1725],
      "name": "Zayyanid Sultanate",
      "flag": "zayyanid"
    },
    {
      "coordinates": [1604, 641],
      "name": "County of Armagnac",
      "flag": "armagnac"
    },
    {
      "coordinates": [946, 1300],
      "name": "City of Cordoba",
      "flag": "cordoba"
    },
    {
      "coordinates": [740, 1021],
      "name": "Kingdom of Leon",
      "flag": "leon"
    },
    {
      "coordinates": [1040, 1036],
      "name": "Crown of Castile",
      "flag": "castille"
    },
    {
      "coordinates": [847, 767],
      "name": "Principality of Asturias",
      "flag": "asturias"
    },
    {
      "coordinates": [1755, 1130],
      "name": "Kingdom of Majorca",
      "flag": "majorca"
    },
    {
      "coordinates": [2004, 1630],
      "name": "Hafsid Sultanate",
      "flag": "hafsid"
    },
    {
      "coordinates": [1374, 926],
      "name": "Kingdom of Aragon",
      "flag": "Crown Of Aragon"
    },
    {
      "coordinates": [1695, 119],
      "name": "City of Paris",
      "flag": "paris"
    },
    {
      "coordinates": [1121, 221],
      "name": "Kingdom of Brittany",
      "flag": "brittany"
    },
    {
      "coordinates": [1933, 614],
      "name": "City of Avignon",
      "flag": "avignon"
    },
    {
      "coordinates": [1434, 129],
      "name": "Duchy of Normandy",
      "flag": "normandy"
    },
    {
      "coordinates": [1644, 383],
      "name": "Kingdom of France",
      "flag": "Franks"
    },
    {
      "coordinates": [772, 1399],
      "name": "City of Seville",
      "flag": "seville"
    },
    {
      "coordinates": [2147, 90],
      "name": "Holy Roman Empire",
      "flag": "Holy Roman Empire"
    }
  ],
  "themes": ["europe"]
}
