{
  "$schema": "../../../info.schema.json",
  "id": "Tourney4",
  "name": "Tourney 8 Teams",
  "translation_key": "map.tourney4",
  "categories": ["tournament"],
  "multiplayer_frequency": 0,
  "nations": [
    {
      "coordinates": [568, 309],
      "name": "North North West"
    },
    {
      "coordinates": [308, 562],
      "name": "West North West"
    },
    {
      "coordinates": [945, 303],
      "name": "North North East"
    },
    {
      "coordinates": [1188, 556],
      "name": "East North East"
    },
    {
      "coordinates": [1196, 931],
      "name": "East South East"
    },
    {
      "coordinates": [941, 1178],
      "name": "South South East"
    },
    {
      "coordinates": [564, 1185],
      "name": "South South West"
    },
    {
      "coordinates": [315, 927],
      "name": "West South West"
    }
  ]
}
