{
  "$schema": "../../../info.schema.json",
  "id": "Luna",
  "name": "Luna",
  "translation_key": "map.luna",
  "categories": ["cosmic"],
  "team_frequency": 15,
  "special_team_count": 2,
  "forced_modifiers": ["isWaterNukes:50"],
  "nations": [
    {
      "coordinates": [265, 662],
      "flag": "us",
      "name": "Apollo 12"
    },
    {
      "coordinates": [550, 600],
      "flag": "us",
      "name": "Apollo 14"
    },
    {
      "coordinates": [780, 340],
      "flag": "us",
      "name": "Apollo 15"
    },
    {
      "coordinates": [825, 705],
      "flag": "us",
      "name": "Apollo 11"
    },
    {
      "coordinates": [875, 990],
      "flag": "us",
      "name": "Apollo 16"
    },
    {
      "coordinates": [1160, 490],
      "flag": "us",
      "name": "Apollo 17"
    },
    {
      "coordinates": [1160, 2850],
      "flag": "us",
      "name": "Surveyor 3"
    },
    {
      "coordinates": [250, 148],
      "flag": "us",
      "name": "Apollo 13"
    },
    {
      "coordinates": [656, 1750],
      "flag": "us",
      "name": "Artemis II"
    },
    {
      "coordinates": [515, 170],
      "flag": "Russian SSR",
      "name": "Luna 17"
    },
    {
      "coordinates": [1050, 385],
      "flag": "Russian SSR",
      "name": "Luna 21"
    },
    {
      "coordinates": [1030, 790],
      "flag": "Russian SSR",
      "name": "Luna 16"
    },
    {
      "coordinates": [1090, 2640],
      "flag": "Russian SSR",
      "name": "Luna 9"
    },
    {
      "coordinates": [130, 2890],
      "flag": "Russian SSR",
      "name": "Luna 24"
    },
    {
      "coordinates": [310, 1167],
      "flag": "Russian SSR",
      "name": "Luna 25"
    },
    {
      "coordinates": [1043, 2393],
      "flag": "Russian SSR",
      "name": "Luna 1"
    },
    {
      "coordinates": [672, 2323],
      "flag": "cn",
      "name": "Chang'e 3"
    },
    {
      "coordinates": [650, 2750],
      "flag": "cn",
      "name": "Chang'e 4"
    },
    {
      "coordinates": [260, 268],
      "flag": "cn",
      "name": "Chang'e 5"
    },
    {
      "coordinates": [910, 3190],
      "flag": "cn",
      "name": "Chang'e 6"
    },
    {
      "coordinates": [830, 745],
      "flag": "jp",
      "name": "S.L.I.M."
    },
    {
      "coordinates": [400, 3360],
      "flag": "in",
      "name": "Chandrayaan 3"
    },
    {
      "coordinates": [732, 3493],
      "flag": "in",
      "name": "Chandrayaan 1"
    },
    {
      "coordinates": [755, 3035],
      "flag": "",
      "name": "T0Þ $e¢®ët Mi|¡tªr¥ ß@§£"
    },
    {
      "coordinates": [628, 921],
      "flag": "custom/luna_monolith",
      "name": "ΜΟΝΟʟΙȚΗ"
    }
  ],
  "teamGameSpawnAreas": {
    "2": [
      {
        "x": 0,
        "y": 0,
        "width": 1308,
        "height": 1754
      },
      {
        "x": 0,
        "y": 1754,
        "width": 1308,
        "height": 1754
      }
    ]
  }
}
