{
  "$schema": "../../../info.schema.json",
  "id": "FourIslands",
  "name": "Four Islands",
  "translation_key": "map.fourislands",
  "categories": ["fictional"],
  "multiplayer_frequency": 4,
  "team_frequency": 30,
  "special_team_count": 4,
  "forced_modifiers": ["isWaterNukes:50"],
  "nations": [
    {
      "coordinates": [403, 1296],
      "flag": "",
      "name": "Korinthal"
    },
    {
      "coordinates": [1152, 1251],
      "flag": "",
      "name": "Lunareth"
    },
    {
      "coordinates": [1328, 322],
      "flag": "",
      "name": "Sylvoria"
    },
    {
      "coordinates": [114, 121],
      "flag": "",
      "name": "Myrkwind"
    }
  ],
  "teamGameSpawnAreas": {
    "2": [
      {
        "x": 0,
        "y": 0,
        "width": 750,
        "height": 1500
      },
      {
        "x": 750,
        "y": 0,
        "width": 750,
        "height": 1500
      }
    ],
    "4": [
      {
        "x": 0,
        "y": 0,
        "width": 750,
        "height": 750
      },
      {
        "x": 750,
        "y": 0,
        "width": 750,
        "height": 750
      },
      {
        "x": 0,
        "y": 750,
        "width": 750,
        "height": 750
      },
      {
        "x": 750,
        "y": 750,
        "width": 750,
        "height": 750
      }
    ]
  }
}
