{
  "$schema": "../../../info.schema.json",
  "id": "Yenisei",
  "name": "Yenisei",
  "translation_key": "map.yenisei",
  "categories": ["asia"],
  "multiplayer_frequency": 6,
  "nations": [
    {
      "coordinates": [1050, 535],
      "flag": "ru",
      "name": "Baikalovsk"
    },
    {
      "coordinates": [1120, 1315],
      "flag": "ru",
      "name": "Mungui"
    },
    {
      "coordinates": [345, 1190],
      "flag": "ru",
      "name": "Polykarpovsk"
    },
    {
      "coordinates": [335, 800],
      "flag": "ru",
      "name": "Central Island"
    },
    {
      "coordinates": [75, 390],
      "flag": "ru",
      "name": "West Coast"
    },
    {
      "coordinates": [420, 440],
      "flag": "ru",
      "name": "Northern Island"
    }
  ],
  "themes": ["asia"]
}
