{
  "$schema": "../../../info.schema.json",
  "name": "Warship Warship",
  "id": "WarshipWarship",
  "translation_key": "map.warshipwarship",
  "multiplayer_frequency": 3,
  "team_frequency": 6,
  "categories": ["arcade"],
  "nations": [
    {
      "coordinates": [750, 680],
      "name": "Isle of Infestation",
      "flag": "Republic of Pirates"
    },
    {
      "coordinates": [1775, 435],
      "name": "Poort",
      "flag": "Republic of Pirates"
    },
    {
      "coordinates": [1884, 1064],
      "name": "Battleship Bay",
      "flag": "Republic of Pirates"
    },
    {
      "coordinates": [1116, 1000],
      "name": "Piracity",
      "flag": "Republic of Pirates"
    },
    {
      "coordinates": [413, 378],
      "name": "Robbery Rock",
      "flag": "Republic of Pirates"
    },
    {
      "coordinates": [1009, 272],
      "name": "Warship Wastelands",
      "flag": "Republic of Pirates"
    },
    {
      "coordinates": [388, 1027],
      "name": "Port Pirate",
      "flag": "Republic of Pirates"
    },
    {
      "coordinates": [2688, 968],
      "name": "Cape Caribbean",
      "flag": "bs"
    },
    {
      "coordinates": [2222, 686],
      "name": "Evil island man"
    },
    {
      "coordinates": [2597, 405],
      "name": "Somalian Sound",
      "flag": "so"
    }
  ],
  "additionalNations": [
    {
      "name": "Just Pirates",
      "flag": "Republic of Pirates"
    },
    {
      "name": "The Pillage",
      "flag": "Republic of Pirates"
    },
    {
      "name": "Nice island man"
    },
    {
      "name": "Bootyful Valley",
      "flag": "Republic of Pirates"
    },
    {
      "name": "Chill island trader"
    },
    {
      "name": "Plunder Peak",
      "flag": "Republic of Pirates"
    },
    {
      "name": "Corsair Cay",
      "flag": "Republic of Pirates"
    },
    {
      "name": "Cutlass Cove",
      "flag": "Republic of Pirates"
    },
    {
      "name": "Galleon Gulf",
      "flag": "Republic of Pirates"
    },
    {
      "name": "Rogue’s Reach",
      "flag": "Republic of Pirates"
    },
    {
      "name": "Buccaneer Bay",
      "flag": "Republic of Pirates"
    },
    {
      "name": "Blackflag Basin",
      "flag": "Republic of Pirates"
    },
    {
      "name": "Dreadnought Dunes",
      "flag": "Republic of Pirates"
    },
    {
      "name": "Armada Anchor",
      "flag": "Republic of Pirates"
    },
    {
      "name": "Caliber Cape",
      "flag": "Republic of Pirates"
    },
    {
      "name": "Salvo Shores",
      "flag": "Republic of Pirates"
    },
    {
      "name": "Bastion Bluffs",
      "flag": "Republic of Pirates"
    },
    {
      "name": "Garrison Atoll",
      "flag": "Republic of Pirates"
    },
    {
      "name": "Vanguard Reef",
      "flag": "Republic of Pirates"
    },
    {
      "name": "Fortress Floe",
      "flag": "Republic of Pirates"
    },
    {
      "name": "Citadel Crag",
      "flag": "Republic of Pirates"
    },
    {
      "name": "Watchpoint Wick",
      "flag": "Republic of Pirates"
    },
    {
      "name": "Redoubt Ridge",
      "flag": "Republic of Pirates"
    }
  ],
  "teamGameSpawnAreas": {
    "2": [
      {
        "height": 1396,
        "width": 1500,
        "x": 0,
        "y": 0
      },
      {
        "height": 1396,
        "width": 1500,
        "x": 1500,
        "y": 0
      }
    ]
  }
}
